{
  "$schema": "https://json-schema.org/draft/2020-12/schema",
  "$id": "https://repocue.local/schema/cache-answer-v1.schema.json",
  "title": "cache-answer",
  "type": "object",
  "properties": {
    "schema_version": {
      "type": "string",
      "enum": [
        "repocue/cache-answer-1"
      ]
    },
    "task_id": {
      "type": "string"
    },
    "required_ids": {
      "type": "array",
      "items": {
        "type": "string"
      }
    },
    "source_ids": {
      "type": "array",
      "items": {
        "type": "string"
      }
    },
    "claims": {
      "type": "array",
      "items": {
        "type": "object",
        "properties": {
          "text": {
            "type": "string"
          },
          "source_ids": {
            "type": "array",
            "items": {
              "type": "string"
            }
          }
        },
        "required": [
          "text",
          "source_ids"
        ],
        "additionalProperties": false
      }
    },
    "uncertainties": {
      "type": "array",
      "items": {
        "type": "string"
      }
    }
  },
  "required": [
    "schema_version",
    "task_id",
    "required_ids",
    "source_ids",
    "claims",
    "uncertainties"
  ],
  "additionalProperties": false
}
